title,page_layout,meta_keywords,meta_description,identifier,content_heading,content,is_active,sort_order,layout_update_xml,custom_theme,custom_root_template,custom_layout_update_xml,custom_theme_from,custom_theme_to
AGB,1column,,,germanlaw_agb,AGB,Hier könnten Ihre AGB stehen.,1,,,,,,,
Widerrufsbelehrung,1column,,,germanlaw_widerrufsbelehrung,Widerrufsbelehrung,Hier könnte Ihre Widerrufsbelehrung stehen.,1,,,,,,,
Impressum,1column,,,germanlaw_impressum,Impressum,Hier könnte Ihr Impressum stehen.,1,,,,,,,
Versandkosten,1column,,,germanlaw_versandkosten,Versandkosten,Hier könnten Ihre Versandkosten stehen.,1,,,,,,,
Datenschutzbestimmung,1column,,,germanlaw_datenschutzbestimmungen,Datenschutzbestimmungen,Hier könnten Ihre Datenschutzbestimmungen stehen.,1,,,,,,,
